Chapter,Section,Subsection,Subsubsection
Numbers and Algebra,Real Numbers,Classifying whole numbers as odd and even in different situations,
Numbers and Algebra,Real Numbers,Classifying whole numbers as prime and composite in different situations,
Numbers and Algebra,Real Numbers,Classifying real numbers as rational and irrational in different situations,
Numbers and Algebra,Real Numbers,Finding reciprocals of real numbers using division,
Numbers and Algebra,Real Numbers,Finding reciprocals of real numbers using mathematical tables and calculators,Finding reciprocals of numbers using mathematical tables
Numbers and Algebra,Real Numbers,Finding reciprocals of real numbers using mathematical tables and calculators,Finding reciprocals using a calculator
Numbers and Algebra,Real Numbers,Using reciprocals of real numbers in mathematical computations,
Numbers and Algebra,Indices and Logarithms,Indices,Expressing Numbers in Index Form
Numbers and Algebra,Indices and Logarithms,Indices,Laws of Indices
Numbers and Algebra,Indices and Logarithms,Indices,Zero and Negative Indices
Numbers and Algebra,Indices and Logarithms,Indices,Applications of Indices in Real-Life situations
Numbers and Algebra,Indices and Logarithms,Logarithms,Logarithms notation
Numbers and Algebra,Indices and Logarithms,Logarithms,Using Logarithms with Standard Form
Numbers and Algebra,Indices and Logarithms,Logarithms,Determining Common Logarithms Using Mathematical Tables and Calculators
Numbers and Algebra,Indices and Logarithms,Logarithms,Multiplying and Dividing Logarithms
Numbers and Algebra,Indices and Logarithms,Logarithms,Applying Logarithms to Powers and Roots
Numbers and Algebra,Quadratic Expressions and Equations 1,Quadratic Expressions,Multiplying a monomial by a binomial.
Numbers and Algebra,Quadratic Expressions and Equations 1,Quadratic Expressions,Multiplying Two Binomials.
Numbers and Algebra,Quadratic Expressions and Equations 1,Quadratic Identities,Difference of Squares.
Numbers and Algebra,Quadratic Expressions and Equations 1,Quadratic Identities,Perfect Squares.
Numbers and Algebra,Quadratic Expressions and Equations 1,Factorisation Of Quadratic Expressions.,Factorisation When The Coefficient Of x^2 Is One
Numbers and Algebra,Quadratic Expressions and Equations 1,Factorisation Of Quadratic Expressions.,Factorisation When The Coefficient Of x^2 Is Not One.
Numbers and Algebra,Quadratic Expressions and Equations 1,Formation of Quadratic Equations by Factorisations.,
Numbers and Algebra,Quadratic Expressions and Equations 1,Solutions Of Quadratic Equations By Factorisations.,
Numbers and Algebra,Quadratic Expressions and Equations 1,Application Of Quadratic Equations To Real Life Situations.,
Measurements and Geometry,Similarity and Enlargement,Similarity,
Measurements and Geometry,Similarity and Enlargement,Enlargement,
Measurements and Geometry,Similarity and Enlargement,Scale Factors,Area Scale Factor
Measurements and Geometry,Similarity and Enlargement,Scale Factors,Volume Scale Factor
Measurements and Geometry,Reflection and Congruence,Identifying Lines of Symmetry Given an Object,
Measurements and Geometry,Reflection and Congruence,Plane of Symmetry,
Measurements and Geometry,Reflection and Congruence,Properties of Reflection,
Measurements and Geometry,Reflection and Congruence,Reflection of Different Shapes on a Plane,
Measurements and Geometry,Reflection and Congruence,Determining the Equation of a Mirror Line ( Line of Reflection) Given an Object and its Image,
Measurements and Geometry,Reflection and Congruence,Congruence,
Measurements and Geometry,Reflection and Congruence,Congruence Tests for Triangles,
Measurements and Geometry,Rotation,Properties of Rotation,Centre and Angle of Rotation
Measurements and Geometry,Rotation,Rotation on Different Planes,Rotation in the Cartesian Plane
Measurements and Geometry,Rotation,Rotational Symmetry,Determining the Order of Rotational Symmetry of Plane Figures
Measurements and Geometry,Rotation,Rotational Symmetry,Determining the Axis of Rotation and Order of Rotational Symmetry in Solids
Measurements and Geometry,Rotation,Rotation and Congruence,
Measurements and Geometry,Trigonometry 1,Trigonometric Ratios of Acute Angles,Tangent of an Acute Angle
Measurements and Geometry,Trigonometry 1,Trigonometric Ratios of Acute Angles,Sine and Cosine of an Acute Angle
Measurements and Geometry,Trigonometry 1,Sines and Cosines of Complimentary Angles,
Measurements and Geometry,Trigonometry 1,"Trigonometric ratios of Special Angles((30°, 45° and 60°))","Tangent, Cosine and Sine of 45°"
Measurements and Geometry,Trigonometry 1,"Trigonometric ratios of Special Angles((30°, 45° and 60°))","Tangent, Cosins and Sine of 30° and 60°"
Measurements and Geometry,Trigonometry 1,Determining Trigonometric Ratios Using a Calculator,
Measurements and Geometry,Trigonometry 1,Application of Trigonometric Ratios,Trigonometric Ratios to Angles of Elevation and Depression
Measurements and Geometry,Area of Polygons,Area of Triangles.,Area of a Triangle using Heron's Formula
Measurements and Geometry,Area of Polygons,Area of Triangles.,Area of a triangle given two sides and an included angle
Measurements and Geometry,Area of Polygons,Area of Quadrilaterals.,Area of a Parallelogram
Measurements and Geometry,Area of Polygons,Area of Quadrilaterals.,Area of a Rhombus
Measurements and Geometry,Area of Polygons,Area of Quadrilaterals.,Area of a Trapezium
Measurements and Geometry,Area of Polygons,Area of Quadrilaterals.,Area of a Kite
Measurements and Geometry,Area of Polygons,Area of Regular Polygons,Area of Heptagon
Measurements and Geometry,Area of Polygons,Area of Regular Polygons,Area of a an Octagon
Measurements and Geometry,Area of Polygons,Area of Regular Polygons,Area of a Nonagon
Measurements and Geometry,Area of Polygons,Area of Regular Polygons,Area of a Decagon
Measurements and Geometry,Area of Polygons,Area of Irregular Polygons,
Measurements and Geometry,Area of a Part of a Circle,Area of an Annulus,
Measurements and Geometry,Area of a Part of a Circle,Area of a Sector of a Circle,
Measurements and Geometry,Area of a Part of a Circle,Area of an Annular Sector,
Measurements and Geometry,Area of a Part of a Circle,Area of a Segment of a Circle,
Measurements and Geometry,Area of a Part of a Circle,Area of Common Region between two Intersecting Circles,
Measurements and Geometry,Surface Area and Volume of Solids,Surface area of Prisms,
Measurements and Geometry,Surface Area and Volume of Solids,Surface area of a cuboid,
Measurements and Geometry,Surface Area and Volume of Solids,Surface Area of a pyramid,
Measurements and Geometry,Surface Area and Volume of Solids,Surface Area of a Sphere,
Measurements and Geometry,Surface Area and Volume of Solids,Surface Area of a Triangular Prism,
Measurements and Geometry,Surface Area and Volume of Solids,Surface area of a Cone,
Measurements and Geometry,Surface Area and Volume of Solids,Surface Area of Composite solids,
Measurements and Geometry,Surface Area and Volume of Solids,Surface area of a Frustum,
Measurements and Geometry,Surface Area and Volume of Solids,Volume of Solids.,
Measurements and Geometry,Surface Area and Volume of Solids,Volume of a Cuboid,
Measurements and Geometry,Surface Area and Volume of Solids,Volume of a Triangular Prism,
Measurements and Geometry,Surface Area and Volume of Solids,Volume of a Pyramid,
Measurements and Geometry,Surface Area and Volume of Solids,Volume of a Cylinder,
Measurements and Geometry,Surface Area and Volume of Solids,Volume of a Sphere,
Measurements and Geometry,Surface Area and Volume of Solids,Volume of a Cone,
Measurements and Geometry,Surface Area and Volume of Solids,Volume of a Frustum,
Measurements and Geometry,Surface Area and Volume of Solids,Volume of Composite solids,
Measurements and Geometry,Vectors I,Vector and Scalar Quantities,
Measurements and Geometry,Vectors I,Representation of Vectors and Vector Notation,
Measurements and Geometry,Vectors I,Equivalent Vectors,
Measurements and Geometry,Vectors I,Addition of Vectors,
Measurements and Geometry,Vectors I,Multiplication of Vectors by a Scalar,
Measurements and Geometry,Vectors I,Column Vectors,
Measurements and Geometry,Vectors I,Position Vectors,
Measurements and Geometry,Vectors I,Magnitude of a Vector,
Measurements and Geometry,Vectors I,Midpoint of a Vector,
Measurements and Geometry,Vectors I,Translation Vector,
Measurements and Geometry,Linear Motion,Speed,
Measurements and Geometry,Linear Motion,Velocity and Acceleration in Different Situations,
Measurements and Geometry,Linear Motion,Displacement Time Graph of Different Situations,
Measurements and Geometry,Linear Motion,Interpretation of Displacement Time Graph,
Measurements and Geometry,Linear Motion,Velocity Time Graph,
Measurements and Geometry,Linear Motion,Relative Speed,When Objects Move in the Same Direction
Measurements and Geometry,Linear Motion,Relative Speed,When Objects Move Toward Each Other (Opposite Directions).
Statistics and Probability,Statistics 1,Collection of Data,Sources of Data
Statistics and Probability,Statistics 1,Collection of Data,Methods of Data Collection
Statistics and Probability,Statistics 1,Representing Data using a Frequency Distribution Table,
Statistics and Probability,Statistics 1,Measures of Central Tendency,Ungrouped Data for Measures of Central Tendency
Statistics and Probability,Statistics 1,Measures of Central Tendency,Grouped Data for Measures of Central Tendency
Statistics and Probability,Statistics 1,Representation of Data,Drawing Histograms and Frequency Polygons of Data
Statistics and Probability,Statistics 1,Interpretation of data,Interpreting Histograms and Frequency Polygons of Data
Statistics and Probability,Probability 1,Introduction to Probability,
Statistics and Probability,Probability 1,Probability Experiment and Sample Space,
Statistics and Probability,Probability 1,Probability of Simple Events,
Statistics and Probability,Probability 1,Mutually Exclusive and Independent Events,Mutually Exclusive
Statistics and Probability,Probability 1,Mutually Exclusive and Independent Events,Independent Events
Statistics and Probability,Probability 1,Law of Probability,Addition Law of Probability
Statistics and Probability,Probability 1,Law of Probability,multiplication rule
Statistics and Probability,Probability 1,Tree Diagrams and Independent Events,
Lesson Plans,Real Numbers,,
